{
  "id": "exaction-squad",
  "name": "Exaction Squad",
  "factionKeyword": "EXACTION SQUAD",
  "archetypes": [
    "security",
    "seek-and-destroy"
  ],
  "selection": {
    "slots": [
      {
        "id": "leader",
        "label": "Leader",
        "count": 1,
        "from": [
          "ex.proctor-exactant"
        ]
      },
      {
        "id": "main",
        "label": "Selections",
        "count": 10,
        "from": [
          "ex.castigator",
          "ex.chirurgant",
          "ex.gunner",
          "ex.leashmaster",
          "ex.malocator",
          "ex.marksman",
          "ex.cyber-mastiff",
          "ex.revelatum",
          "ex.subductor",
          "ex.vigilant",
          "ex.vox-signifier"
        ],
        "repeatable": [
          "ex.gunner",
          "ex.subductor",
          "ex.vigilant"
        ]
      }
    ],
    "caps": [
      {
        "label": "Gunners",
        "from": [
          "ex.gunner"
        ],
        "max": 2
      },
      {
        "label": "Subductors",
        "from": [
          "ex.subductor"
        ],
        "max": 4
      }
    ],
    "loadoutCaps": [
      {
        "label": "Gunner weapon",
        "weapons": [
          "ex.w.grenade-launcher",
          "ex.wg.heavy-stubber",
          "ex.w.webber"
        ],
        "max": 1,
        "each": true
      }
    ]
  },
  "factionRules": [
    "ex.a.ruthless-efficiency"
  ],
  "ploys": [
    "ex.p.marked-for-justice",
    "ex.p.attack-pattern",
    "ex.p.first-in-the-field",
    "ex.p.guilt-reveals-itself",
    "ex.p.inviolate-jurisdiction",
    "ex.p.dispense-justice",
    "ex.p.terminal-decree",
    "ex.p.long-arm",
    "ex.p.exact-punishment",
    "ex.p.brutal-backup",
    "ex.p.execution-order"
  ],
  "equipment": [
    "ex.e.reinforced-mirror-visor",
    "ex.e.manacles",
    "ex.e.strobing-phosphor-lumen",
    "ex.e.special-issue-shells"
  ],
  "playable": true,
  "defaults": {
    "roster": [
      "ex.proctor-exactant",
      "ex.castigator",
      "ex.chirurgant",
      "ex.gunner",
      "ex.gunner",
      "ex.leashmaster",
      "ex.cyber-mastiff",
      "ex.marksman",
      "ex.subductor",
      "ex.subductor",
      "ex.vigilant"
    ],
    "equipment": [
      "ex.e.reinforced-mirror-visor",
      "ex.e.strobing-phosphor-lumen",
      "core.e.ladders",
      "core.e.utility-grenades"
    ],
    "loadouts": [
      {},
      {},
      {},
      {
        "special": [
          "ex.w.grenade-launcher"
        ]
      },
      {
        "special": [
          "ex.wg.heavy-stubber"
        ]
      },
      {},
      {},
      {},
      {},
      {},
      {}
    ]
  },
  "paint": {
    "major": {
      "h": 0.62,
      "s": 0.08,
      "l": 0.14
    },
    "minor": {
      "h": 0.12,
      "s": 0.85,
      "l": 0.5
    }
  },
  "text": "Imperial lawkeepers in black carapace who name one quarry each turning point, pin it in place with shields, mauls and a cyber-hound, and refuse to let it walk away.",
  "source": "team-exaction-squad.pdf (Jun '26); docs/spec/13-teams.md section 24"
}
