{
  "id": "wyrmblade",
  "name": "Wyrmblade",
  "factionKeyword": "WYRMBLADE",
  "archetypes": [
    "seek-and-destroy",
    "infiltration"
  ],
  "selection": {
    "slots": [
      {
        "id": "leader",
        "label": "Leader",
        "count": 1,
        "from": [
          "wyr.neophyte-leader"
        ]
      }
    ]
  },
  "factionRules": [],
  "ploys": [],
  "equipment": [],
  "playable": false,
  "defaults": {
    "roster": [
      "wyr.neophyte-leader"
    ],
    "equipment": []
  },
  "paint": {
    "major": {
      "h": 0.78,
      "s": 0.35,
      "l": 0.35
    },
    "minor": {
      "h": 0.1,
      "s": 0.5,
      "l": 0.45
    }
  },
  "text": "A cult strike cell: a Neophyte Leader, a crowd of Neophytes who hide and ambush, and a few deadly cult agents.",
  "source": "wahapedia kill-teams wyrmblade; docs/spec/13-teams.md section 6"
}
