{
  "id": "farstalker-kinband",
  "name": "Farstalker Kinband",
  "factionKeyword": "FARSTALKER KINBAND",
  "archetypes": [
    "infiltration",
    "recon"
  ],
  "selection": {
    "caps": [
      {
        "label": "Hounds",
        "from": [
          "fk.hound"
        ],
        "max": 2
      }
    ],
    "slots": [
      {
        "id": "leader",
        "label": "Leader",
        "count": 1,
        "from": [
          "fk.kill-broker"
        ]
      },
      {
        "id": "main",
        "label": "Selections",
        "count": 11,
        "from": [
          "fk.bow-hunter",
          "fk.cold-blood",
          "fk.cut-skin",
          "fk.heavy-gunner",
          "fk.hound",
          "fk.long-sight",
          "fk.pistolier",
          "fk.stalker",
          "fk.tracker",
          "fk.warrior"
        ],
        "repeatable": [
          "fk.hound",
          "fk.warrior"
        ]
      }
    ]
  },
  "factionRules": [
    "fk.a.farstalker"
  ],
  "ploys": [
    "fk.p.call-the-kill",
    "fk.p.cut-throats",
    "fk.p.rogue",
    "fk.p.prey",
    "fk.p.bound",
    "fk.p.savage-ambush",
    "fk.p.slip-away",
    "fk.p.poach",
    "fk.p.vengeance-for-the-kinband"
  ],
  "equipment": [
    "fk.e.piercing-shot",
    "fk.e.toxin-shot",
    "fk.e.meat",
    "fk.e.trophy"
  ],
  "playable": true,
  "defaults": {
    "roster": [
      "fk.kill-broker",
      "fk.bow-hunter",
      "fk.cold-blood",
      "fk.cut-skin",
      "fk.heavy-gunner",
      "fk.hound",
      "fk.long-sight",
      "fk.pistolier",
      "fk.stalker",
      "fk.tracker",
      "fk.warrior",
      "fk.warrior"
    ],
    "equipment": [
      "fk.e.piercing-shot",
      "fk.e.meat",
      "core.e.ladders",
      "core.e.utility-grenades"
    ]
  },
  "paint": {
    "major": {
      "h": 0.1,
      "s": 0.45,
      "l": 0.35
    },
    "minor": {
      "h": 0.05,
      "s": 0.6,
      "l": 0.45
    }
  },
  "text": "Kroot mercenary hunters and their hounds: they pick a mark, stalk it through cover and change stance in a heartbeat.",
  "source": "team-farstalker-kinband.pdf (Jun '26); docs/spec/13-teams.md section 16"
}
