{
  "id": "corsair-voidscarred",
  "name": "Corsair Voidscarred",
  "factionKeyword": "CORSAIR VOIDSCARRED",
  "archetypes": [
    "infiltration",
    "recon"
  ],
  "selection": {
    "slots": [
      {
        "id": "leader",
        "label": "Leader",
        "count": 1,
        "from": [
          "cv.felarch"
        ]
      },
      {
        "id": "main",
        "label": "Selections",
        "count": 8,
        "from": [
          "cv.fate-dealer",
          "cv.gunner",
          "cv.heavy-gunner",
          "cv.kurnathi",
          "cv.kurnite-hunter",
          "cv.shade-runner",
          "cv.soul-weaver",
          "cv.starstorm-duellist",
          "cv.warrior",
          "cv.way-seeker"
        ],
        "repeatable": [
          "cv.warrior"
        ]
      }
    ],
    "loadoutCaps": [
      {
        "label": "blaster or wraithcannon",
        "weapons": [
          "cv.w.blaster",
          "cv.w.wraithcannon"
        ],
        "max": 1
      }
    ]
  },
  "factionRules": [
    "cv.a.rifles",
    "cv.a.aeldari-raiders"
  ],
  "ploys": [
    "cv.p.plunderers",
    "cv.p.piratical-profiteers",
    "cv.p.mobile-engagement",
    "cv.p.outcasts",
    "cv.p.opportunistic-fighters",
    "cv.p.light-fingers",
    "cv.p.capricious-flight",
    "cv.p.contemptuous-adventurer",
    "cv.p.erudite-hunter",
    "cv.p.star-charts"
  ],
  "equipment": [
    "cv.e.diuturnal-mantles",
    "cv.e.mistfield",
    "cv.e.runes-of-guidance",
    "cv.e.star-charts"
  ],
  "playable": true,
  "defaults": {
    "roster": [
      "cv.felarch",
      "cv.fate-dealer",
      "cv.gunner",
      "cv.heavy-gunner",
      "cv.kurnathi",
      "cv.kurnite-hunter",
      "cv.shade-runner",
      "cv.starstorm-duellist",
      "cv.warrior"
    ],
    "equipment": [
      "cv.e.mistfield",
      "cv.e.star-charts",
      "core.e.ladders",
      "core.e.utility-grenades"
    ]
  },
  "paint": {
    "major": {
      "h": 0.75,
      "s": 0.35,
      "l": 0.25
    },
    "minor": {
      "h": 0,
      "s": 0.7,
      "l": 0.45
    }
  },
  "text": "Aeldari void pirates: quick raiders who dash in, snatch the prize and vanish before the foe can answer.",
  "source": "team-corsair-voidscarred.pdf (Jan '26); docs/spec/13-teams.md section 14"
}
