{
  "id": "goremongers",
  "name": "Goremongers",
  "factionKeyword": "GOREMONGER",
  "archetypes": [
    "recon",
    "seek-and-destroy"
  ],
  "selection": {
    "slots": [
      {
        "id": "leader",
        "label": "Leader",
        "count": 1,
        "from": [
          "gm.blood-herald"
        ]
      },
      {
        "id": "main",
        "label": "Selections",
        "count": 7,
        "from": [
          "gm.aspirant",
          "gm.bloodtaker",
          "gm.impaler",
          "gm.inciter",
          "gm.skullclaimer",
          "gm.stalker"
        ],
        "repeatable": [
          "gm.aspirant"
        ]
      }
    ]
  },
  "factionRules": [
    "gm.a.runes-of-khorne",
    "gm.a.gore-tanks",
    "gm.a.sanguavitae",
    "gm.a.rejuvenate",
    "gm.a.mania",
    "gm.a.fury",
    "gm.a.rake",
    "gm.a.surge",
    "gm.a.rage"
  ],
  "ploys": [
    "gm.p.enhanced-violence",
    "gm.p.augmented-endurance",
    "gm.p.gory-tenacity",
    "gm.p.hunt-for-blood",
    "gm.p.unbridled-aggression",
    "gm.p.gorethirst",
    "gm.p.destructive-demise",
    "gm.p.lacerate-flesh"
  ],
  "equipment": [
    "gm.e.gory-totem",
    "gm.e.bloody-cadaver",
    "gm.e.chaos-sigil",
    "gm.e.wrist-chains"
  ],
  "playable": true,
  "defaults": {
    "roster": [
      "gm.blood-herald",
      "gm.aspirant",
      "gm.aspirant",
      "gm.bloodtaker",
      "gm.impaler",
      "gm.inciter",
      "gm.skullclaimer",
      "gm.stalker"
    ],
    "equipment": [
      "gm.e.chaos-sigil",
      "gm.e.wrist-chains",
      "core.e.ladders",
      "core.e.utility-grenades"
    ]
  },
  "paint": {
    "major": {
      "h": 0.0,
      "s": 0.65,
      "l": 0.32
    },
    "minor": {
      "h": 0.08,
      "s": 0.3,
      "l": 0.55
    }
  },
  "text": "Blood-mad human cultists of the war god who feed stolen gore into their back-mounted tanks and burn it for bursts of speed, fury and healing.",
  "source": "team-goremongers.pdf (Aug '26); docs/spec/13-teams.md section 21"
}
